[
  {
    "version": 1,
    "id": "vision.hand.right.height",
    "kind": "slider",
    "value": 0.05,
    "confidence": 0.95,
    "t_ms": 0
  },
  {
    "version": 1,
    "id": "vision.hand.right.height",
    "kind": "slider",
    "value": 0.053,
    "confidence": 0.95,
    "t_ms": 67
  },
  {
    "version": 1,
    "id": "vision.hand.right.height",
    "kind": "slider",
    "value": 0.06,
    "confidence": 0.95,
    "t_ms": 133
  },
  {
    "version": 1,
    "id": "vision.hand.right.height",
    "kind": "slider",
    "value": 0.073,
    "confidence": 0.95,
    "t_ms": 200
  },
  {
    "version": 1,
    "id": "vision.hand.right.height",
    "kind": "slider",
    "value": 0.09,
    "confidence": 0.95,
    "t_ms": 267
  },
  {
    "version": 1,
    "id": "vision.hand.right.height",
    "kind": "slider",
    "value": 0.112,
    "confidence": 0.95,
    "t_ms": 333
  },
  {
    "version": 1,
    "id": "vision.hand.right.height",
    "kind": "slider",
    "value": 0.139,
    "confidence": 0.95,
    "t_ms": 400
  },
  {
    "version": 1,
    "id": "vision.hand.right.height",
    "kind": "slider",
    "value": 0.169,
    "confidence": 0.95,
    "t_ms": 467
  },
  {
    "version": 1,
    "id": "vision.hand.right.height",
    "kind": "slider",
    "value": 0.204,
    "confidence": 0.95,
    "t_ms": 533
  },
  {
    "version": 1,
    "id": "vision.hand.right.height",
    "kind": "slider",
    "value": 0.241,
    "confidence": 0.95,
    "t_ms": 600
  },
  {
    "version": 1,
    "id": "vision.hand.right.height",
    "kind": "slider",
    "value": 0.282,
    "confidence": 0.95,
    "t_ms": 667
  },
  {
    "version": 1,
    "id": "vision.hand.right.height",
    "kind": "slider",
    "value": 0.325,
    "confidence": 0.95,
    "t_ms": 733
  },
  {
    "version": 1,
    "id": "vision.hand.right.height",
    "kind": "slider",
    "value": 0.37,
    "confidence": 0.95,
    "t_ms": 800
  },
  {
    "version": 1,
    "id": "vision.hand.right.height",
    "kind": "slider",
    "value": 0.417,
    "confidence": 0.95,
    "t_ms": 867
  },
  {
    "version": 1,
    "id": "vision.hand.right.height",
    "kind": "slider",
    "value": 0.464,
    "confidence": 0.95,
    "t_ms": 933
  },
  {
    "version": 1,
    "id": "vision.hand.right.height",
    "kind": "slider",
    "value": 0.512,
    "confidence": 0.95,
    "t_ms": 1000
  },
  {
    "version": 1,
    "id": "vision.hand.right.height",
    "kind": "slider",
    "value": 0.56,
    "confidence": 0.95,
    "t_ms": 1067
  },
  {
    "version": 1,
    "id": "vision.hand.right.height",
    "kind": "slider",
    "value": 0.607,
    "confidence": 0.95,
    "t_ms": 1133
  },
  {
    "version": 1,
    "id": "vision.hand.right.height",
    "kind": "slider",
    "value": 0.653,
    "confidence": 0.95,
    "t_ms": 1200
  },
  {
    "version": 1,
    "id": "vision.hand.right.height",
    "kind": "slider",
    "value": 0.697,
    "confidence": 0.95,
    "t_ms": 1267
  },
  {
    "version": 1,
    "id": "vision.hand.right.height",
    "kind": "slider",
    "value": 0.739,
    "confidence": 0.95,
    "t_ms": 1333
  },
  {
    "version": 1,
    "id": "vision.hand.right.height",
    "kind": "slider",
    "value": 0.778,
    "confidence": 0.95,
    "t_ms": 1400
  },
  {
    "version": 1,
    "id": "vision.hand.right.height",
    "kind": "slider",
    "value": 0.814,
    "confidence": 0.95,
    "t_ms": 1467
  },
  {
    "version": 1,
    "id": "vision.hand.right.height",
    "kind": "slider",
    "value": 0.846,
    "confidence": 0.95,
    "t_ms": 1533
  },
  {
    "version": 1,
    "id": "vision.hand.right.height",
    "kind": "slider",
    "value": 0.875,
    "confidence": 0.95,
    "t_ms": 1600
  },
  {
    "version": 1,
    "id": "vision.hand.right.height",
    "kind": "slider",
    "value": 0.899,
    "confidence": 0.95,
    "t_ms": 1667
  },
  {
    "version": 1,
    "id": "vision.hand.right.height",
    "kind": "slider",
    "value": 0.919,
    "confidence": 0.95,
    "t_ms": 1733
  },
  {
    "version": 1,
    "id": "vision.hand.right.height",
    "kind": "slider",
    "value": 0.934,
    "confidence": 0.95,
    "t_ms": 1800
  },
  {
    "version": 1,
    "id": "vision.hand.right.height",
    "kind": "slider",
    "value": 0.944,
    "confidence": 0.95,
    "t_ms": 1867
  },
  {
    "version": 1,
    "id": "vision.hand.right.height",
    "kind": "slider",
    "value": 0.949,
    "confidence": 0.95,
    "t_ms": 1933
  },
  {
    "version": 1,
    "id": "vision.hand.right.height",
    "kind": "slider",
    "value": 0.949,
    "confidence": 0.95,
    "t_ms": 2000
  },
  {
    "version": 1,
    "id": "vision.hand.right.height",
    "kind": "slider",
    "value": 0.944,
    "confidence": 0.95,
    "t_ms": 2067
  },
  {
    "version": 1,
    "id": "vision.hand.right.height",
    "kind": "slider",
    "value": 0.934,
    "confidence": 0.95,
    "t_ms": 2133
  },
  {
    "version": 1,
    "id": "vision.hand.right.height",
    "kind": "slider",
    "value": 0.919,
    "confidence": 0.95,
    "t_ms": 2200
  },
  {
    "version": 1,
    "id": "vision.hand.right.height",
    "kind": "slider",
    "value": 0.899,
    "confidence": 0.95,
    "t_ms": 2267
  },
  {
    "version": 1,
    "id": "vision.hand.right.height",
    "kind": "slider",
    "value": 0.875,
    "confidence": 0.95,
    "t_ms": 2333
  },
  {
    "version": 1,
    "id": "vision.hand.right.height",
    "kind": "slider",
    "value": 0.846,
    "confidence": 0.95,
    "t_ms": 2400
  },
  {
    "version": 1,
    "id": "vision.hand.right.height",
    "kind": "slider",
    "value": 0.814,
    "confidence": 0.95,
    "t_ms": 2467
  },
  {
    "version": 1,
    "id": "vision.hand.right.height",
    "kind": "slider",
    "value": 0.778,
    "confidence": 0.95,
    "t_ms": 2533
  },
  {
    "version": 1,
    "id": "vision.hand.right.height",
    "kind": "slider",
    "value": 0.739,
    "confidence": 0.95,
    "t_ms": 2600
  },
  {
    "version": 1,
    "id": "vision.hand.right.height",
    "kind": "slider",
    "value": 0.697,
    "confidence": 0.95,
    "t_ms": 2667
  },
  {
    "version": 1,
    "id": "vision.hand.right.height",
    "kind": "slider",
    "value": 0.653,
    "confidence": 0.95,
    "t_ms": 2733
  },
  {
    "version": 1,
    "id": "vision.hand.right.height",
    "kind": "slider",
    "value": 0.607,
    "confidence": 0.95,
    "t_ms": 2800
  },
  {
    "version": 1,
    "id": "vision.hand.right.height",
    "kind": "slider",
    "value": 0.56,
    "confidence": 0.95,
    "t_ms": 2867
  },
  {
    "version": 1,
    "id": "vision.hand.right.height",
    "kind": "slider",
    "value": 0.512,
    "confidence": 0.95,
    "t_ms": 2933
  },
  {
    "version": 1,
    "id": "vision.hand.right.height",
    "kind": "slider",
    "value": 0.464,
    "confidence": 0.95,
    "t_ms": 3000
  },
  {
    "version": 1,
    "id": "vision.hand.right.height",
    "kind": "slider",
    "value": 0.417,
    "confidence": 0.95,
    "t_ms": 3067
  },
  {
    "version": 1,
    "id": "vision.hand.right.height",
    "kind": "slider",
    "value": 0.37,
    "confidence": 0.95,
    "t_ms": 3133
  },
  {
    "version": 1,
    "id": "vision.hand.right.height",
    "kind": "slider",
    "value": 0.325,
    "confidence": 0.95,
    "t_ms": 3200
  },
  {
    "version": 1,
    "id": "vision.hand.right.height",
    "kind": "slider",
    "value": 0.282,
    "confidence": 0.95,
    "t_ms": 3267
  },
  {
    "version": 1,
    "id": "vision.hand.right.height",
    "kind": "slider",
    "value": 0.241,
    "confidence": 0.95,
    "t_ms": 3333
  },
  {
    "version": 1,
    "id": "vision.hand.right.height",
    "kind": "slider",
    "value": 0.204,
    "confidence": 0.95,
    "t_ms": 3400
  },
  {
    "version": 1,
    "id": "vision.hand.right.height",
    "kind": "slider",
    "value": 0.169,
    "confidence": 0.95,
    "t_ms": 3467
  },
  {
    "version": 1,
    "id": "vision.hand.right.height",
    "kind": "slider",
    "value": 0.139,
    "confidence": 0.95,
    "t_ms": 3533
  },
  {
    "version": 1,
    "id": "vision.hand.right.height",
    "kind": "slider",
    "value": 0.112,
    "confidence": 0.95,
    "t_ms": 3600
  },
  {
    "version": 1,
    "id": "vision.hand.right.height",
    "kind": "slider",
    "value": 0.09,
    "confidence": 0.95,
    "t_ms": 3667
  },
  {
    "version": 1,
    "id": "vision.hand.right.height",
    "kind": "slider",
    "value": 0.073,
    "confidence": 0.95,
    "t_ms": 3733
  },
  {
    "version": 1,
    "id": "vision.hand.right.height",
    "kind": "slider",
    "value": 0.06,
    "confidence": 0.95,
    "t_ms": 3800
  },
  {
    "version": 1,
    "id": "vision.hand.right.height",
    "kind": "slider",
    "value": 0.053,
    "confidence": 0.95,
    "t_ms": 3867
  },
  {
    "version": 1,
    "id": "vision.hand.right.height",
    "kind": "slider",
    "value": 0.05,
    "confidence": 0.95,
    "t_ms": 3933
  }
]
